{
  "schemaVersion": 1,
  "assetId": "visual-alpha/safety-cone",
  "version": "0.1.0",
  "kind": "generic",
  "format": "glb",
  "fileFrame": "visual-alpha/safety-cone",
  "fileCoordinate": {
    "handedness": "right",
    "upAxis": "+Z",
    "forwardAxis": "+X",
    "metersPerUnit": 1
  },
  "coreFrame": "lk-world",
  "fileToCoreTransform": {
    "sourceFrame": "visual-alpha/safety-cone",
    "targetFrame": "lk-world",
    "translation": [
      0,
      0,
      0
    ],
    "rotation": [
      0,
      0,
      0,
      1
    ]
  },
  "boundsInCoreMeters": {
    "frame": "lk-world",
    "min": [
      -0.25,
      -0.25,
      0
    ],
    "max": [
      0.25,
      0.25,
      0.785
    ]
  },
  "integrity": {
    "sha256": "986a2c408460923639bb1d8f211e457216b3f03673f3fd3726f3580d039ebda5"
  }
}
