{
  "schemaVersion": 1,
  "assetId": "visual-alpha/charging-station",
  "version": "0.1.0",
  "kind": "generic",
  "format": "glb",
  "fileFrame": "visual-alpha/charging-station",
  "fileCoordinate": {
    "handedness": "right",
    "upAxis": "+Z",
    "forwardAxis": "+X",
    "metersPerUnit": 1
  },
  "coreFrame": "lk-world",
  "fileToCoreTransform": {
    "sourceFrame": "visual-alpha/charging-station",
    "targetFrame": "lk-world",
    "translation": [
      0,
      0,
      0
    ],
    "rotation": [
      0,
      0,
      0,
      1
    ]
  },
  "boundsInCoreMeters": {
    "frame": "lk-world",
    "min": [
      -0.36,
      -0.41,
      0
    ],
    "max": [
      0.513048,
      0.41,
      1.36
    ]
  },
  "integrity": {
    "sha256": "fb5c12e45877d83381d4218e866a77fce85ed78cb184396f9400fd15ab3745b9"
  }
}
